{
  "format": "budok.character.v1",
  "character": "Cowboy",
  "provenance": {
    "by": "budok maintainers",
    "source": "curated move catalog and character guides from budok-ai"
  },
  "summary": {
    "archetype": "versatile all-rounder",
    "game_plan": "Cowboy is a versatile all-rounder with tools for every range.",
    "tips": [
      "At close range (<50 units): Pommel (h_reach 28, fast, safe), Grab (50), VSlash (68, high damage), 3Combo (48). Mix attacks and grabs.",
      "At mid range (50-110 units): HSlash2 (h_reach 109), Stinger (82 + lunge), AnkleCutter (92). Cowboy's sword normals are excellent here.",
      "At long range (110+ units): LightningSliceNeutral (h_reach 147, travels through air), Brandish → Shoot (fullscreen gun), Lasso (250, long-range grab).",
      "Movement: When >150 units, use Walk Forward or Dash to close into sword range. Super Dash covers big gaps with armor. Don't spam LightningSlice from fullscreen — close distance and use higher-damage melee instead.",
      "Defense: SpotDodge (invuln frames 5-7, fast recovery) and Foresight are strong.",
      "Cowboy wins by mixing all three ranges. Don't camp one distance."
    ]
  },
  "moves": {
    "1000Cuts": {
      "category": "super",
      "summary": "1000 Cuts — projectile buff super, enhances all attacks. Costs meter.",
      "beats": "buffs your next attacks significantly",
      "loses_to": "costs meter, vulnerable during activation"
    },
    "1000CutsEnd": {
      "category": "super",
      "summary": "End 1000 Cuts buff early with Fatal Cut."
    },
    "3Combo": {
      "category": "attack",
      "range": "mid",
      "summary": "3-hit combo — automatic multi-hit string. Good after Pommel.",
      "beats": "opponents caught in pressure",
      "loses_to": "loses to blocking, committed multi-hit"
    },
    "3ComboDown": {
      "category": "attack",
      "range": "mid",
      "summary": "Aerial 3-hit combo."
    },
    "AirGrab": {
      "category": "grab",
      "summary": "Aerial throw — air-to-air grab option.",
      "beats": "airborne blocking opponents",
      "loses_to": "loses to air attacks, requires both players airborne"
    },
    "AnkleCutter": {
      "category": "attack",
      "range": "mid",
      "summary": "Ankle Cutter — low sweep, hits crouching opponents.",
      "beats": "opponents blocking high",
      "loses_to": "loses to jumping opponents"
    },
    "BackSlash": {
      "category": "attack",
      "range": "mid",
      "summary": "Backward slash — retreat while attacking. Safe spacing tool.",
      "beats": "creates space while dealing damage",
      "loses_to": "lower damage than committed attacks, gives up position"
    },
    "Brandish": {
      "category": "special",
      "summary": "Quick Draw stance entry. Unlocks Shoot, PointBlank, PistolWhip, and ShootDodge next turn. Use this to access gun moves.",
      "beats": "sets up powerful gun options",
      "loses_to": "costs a turn to set up, does no damage itself",
      "combo_hint": "Unlocks: Shoot2, ShootDodge2, PointBlank, PistolWhip"
    },
    "ChargeDash": {
      "category": "movement",
      "summary": "Super Dash: a short wind-up (see its frames) followed by a long dash forward. Best for crossing large distances; beats backdashes.",
      "beats": "backdashes and opponents far away",
      "loses_to": "attacks and throws during the wind-up; punishable if predicted"
    },
    "Continue": {
      "category": "utility",
      "summary": "Continue current action/state."
    },
    "Dash": {
      "category": "movement",
      "summary": "Dash: a quick forward hop; actionable early (see its frames). Use it to close distance fast.",
      "beats": "backdashes; slow approaches",
      "loses_to": "well-timed attacks and anti-airs; covers less ground than Super Dash"
    },
    "DashBackward": {
      "category": "movement",
      "summary": "Dash Back: quick retreat. It cannot end early while the opponent's forward dash (or another move that beats backdashes) is running.",
      "beats": "close-range pressure and throws by moving out of range; creates space",
      "loses_to": "forward dashes that chase it; gives up stage space and can corner you"
    },
    "DashForward": {
      "category": "movement",
      "summary": "Dash Forward: quick grounded dash toward the opponent; the payload (0-100) sets how far. While it runs, an opponent's backdash cannot end early. Use it to get into attack or throw range, then attack next turn.",
      "beats": "backdashes; closes the gap so your attacks can connect",
      "loses_to": "attacks timed against your approach; predictable if repeated"
    },
    "DefensiveBurst": {
      "category": "defense",
      "summary": "Burst: an invulnerable reversal that knocks the opponent away; your way out of combos and pressure. Spends your burst stock (at most one at a time); the burst meter refills over time and faster when you take damage.",
      "beats": "combos and close pressure",
      "loses_to": "being baited (the opponent blocks or backs off and punishes); afterwards you have no burst until the meter refills"
    },
    "DoubleJump": {
      "category": "movement",
      "summary": "Double Jump — second jump while airborne. Changes your air trajectory. Use to extend airtime, dodge anti-airs, or reposition in the air.",
      "beats": "dodges anti-airs by changing trajectory, extends air control.",
      "loses_to": "uses your air action, can't double jump again."
    },
    "DownwardCleave": {
      "category": "attack",
      "range": "mid",
      "summary": "Aerial downward cleave."
    },
    "DownwardCleaveGround": {
      "category": "attack",
      "range": "mid",
      "summary": "Ground downward cleave."
    },
    "Fall": {
      "category": "movement",
      "summary": "Fall — drop from the air quickly. Use to land faster and become actionable sooner instead of floating. Good after a whiffed air attack or to bait anti-airs.",
      "beats": "lands quickly to act sooner, baits anti-airs that expect you to stay airborne.",
      "loses_to": "predictable landing spot."
    },
    "FastTeleport": {
      "category": "super",
      "range": "far",
      "summary": "Teleport — instant repositioning super. Costs meter.",
      "beats": "escapes pressure, repositions instantly",
      "loses_to": "costs meter, does no damage"
    },
    "Foresight": {
      "category": "special",
      "summary": "Place temporal afterimage marker. Can teleport back to it later.",
      "beats": "creates escape option / mixup potential",
      "loses_to": "does no damage, costs a turn to set up"
    },
    "ForesightNeutral": {
      "category": "special",
      "summary": "Neutral Foresight placement."
    },
    "ForwardDashFollowup": {
      "category": "attack",
      "summary": "Follow-up attack after a forward dash. Good for closing distance and attacking.",
      "beats": "blocking opponents at mid range",
      "loses_to": "punishable on block if predicted"
    },
    "Getup": {
      "category": "utility",
      "summary": "Wake up from knockdown."
    },
    "Grab": {
      "category": "grab",
      "range": "close",
      "summary": "Throw: grabs a grounded opponent. Beats blocking and parrying. Very short range: its box reaches only about 20 in front of your center (see its measured reach), so with the opponent's body you need a center distance of about 30 or less. Get in first with Dash Forward.",
      "beats": "blocking and parrying opponents who are touching you",
      "loses_to": "any attack that comes out first, jumps, and stepping or dashing back; whiffs at even a little distance"
    },
    "GunReel": {
      "category": "special",
      "range": "far",
      "summary": "Pull thrown gun back with lasso."
    },
    "GunThrow": {
      "category": "special",
      "range": "far",
      "summary": "Throw your gun as a projectile. Loses gun access until retrieved.",
      "loses_to": "loses gun access, need GunReel to recover"
    },
    "Guntrick": {
      "category": "defense",
      "summary": "Gun Trick — counter-parry with gun. Counters attacks with a shot.",
      "beats": "punishes attacks automatically",
      "loses_to": "loses to grabs, low damage"
    },
    "HAirSlash": {
      "category": "attack",
      "range": "mid",
      "summary": "Aerial Horizontal Slash."
    },
    "HSlash2": {
      "category": "attack",
      "range": "mid",
      "summary": "Horizontal Slash — mid-range sword swing.",
      "beats": "opponents in range without blocking",
      "loses_to": "loses to blocking (punishable), slow startup vs fast attacks"
    },
    "Holster": {
      "category": "special",
      "summary": "Holster gun — exit Quick Draw stance."
    },
    "Impale": {
      "category": "grab",
      "range": "close",
      "summary": "Impale — very high damage commitment. Huge risk, huge reward.",
      "beats": "blocking opponents, massive damage if it lands",
      "loses_to": "extremely slow, any attack beats it, huge whiff punish",
      "risk": "high"
    },
    "ImpaleTeleport": {
      "category": "attack",
      "range": "far",
      "summary": "Teleport Impale variant — teleports behind opponent regardless of distance."
    },
    "InstantCancel": {
      "category": "utility",
      "summary": "Cancel current move animation instantly. Costs meter."
    },
    "IzunaDrop": {
      "category": "grab",
      "range": "close",
      "summary": "Izuna Drop — high-damage command grab.",
      "beats": "blocking opponents at close range",
      "loses_to": "very slow, easily interrupted by any attack",
      "risk": "high"
    },
    "Jump": {
      "category": "movement",
      "summary": "Jump — become airborne. JumpArc payload controls trajectory (x: horizontal direction, y: height). Startup 2-5 ticks. Short jumps actionable in ~10 ticks, high jumps ~15. Avoids grabs and ground attacks. Enables aerial attacks on landing.",